{
  "$schema": "https://json-schema.org/draft/2020-12/schema",
  "$id": "https://anvil.dev/schemas/v1/stream.json",
  "title": "Anvil run stream (schema version 1)",
  "description": "One ordered event stream within a run. Sequences are per stream; there is no global total order across streams.",
  "type": "object",
  "additionalProperties": false,
  "required": ["schema_version", "stream_id", "run_id", "kind", "last_sequence", "open"],
  "properties": {
    "schema_version": { "$ref": "defs.json#/$defs/schemaVersion" },
    "stream_id": { "$ref": "defs.json#/$defs/uuidv7" },
    "run_id": { "$ref": "defs.json#/$defs/uuidv7" },
    "kind": {
      "description": "What this stream carries.",
      "type": "string",
      "enum": ["agent", "model", "tool"]
    },
    "parent_stream_id": {
      "description": "Parent stream for nested agents or parallel branches.",
      "$ref": "defs.json#/$defs/uuidv7"
    },
    "logical_path": {
      "description": "Stable logical invocation path used for fixture matching, e.g. \"/agent/a/tool/0\".",
      "type": "string"
    },
    "last_sequence": {
      "description": "Highest sequence observed on this stream; -1 when no events have been recorded.",
      "type": "integer",
      "minimum": -1
    },
    "open": {
      "description": "True while the stream may still accept events; false once it reached a terminal event.",
      "type": "boolean"
    }
  }
}
